{
  "conditions": [
    {
      "expression": "At(u, t, 0) - sin(pi*x)",
      "name": "initial condition"
    },
    {
      "expression": "At(u, x, 0)",
      "name": "left boundary"
    },
    {
      "expression": "At(u, x, 1)",
      "name": "right boundary"
    }
  ],
  "domains": {
    "t": [
      0.0,
      1.0
    ],
    "x": [
      0.0,
      1.0
    ]
  },
  "fields": {
    "u": "2*t*x**3*(4*x - 4)**3*(4*x - 3)**3*(4*x - 2)**3*(4*x - 1)**3/(3125*(3*x - 1)) + exp(-pi**2*t)*sin(pi*x)"
  },
  "name": "hidden_singularity",
  "parameters": {},
  "pde_residuals": [
    {
      "expression": "D(u, t) - D(u, x, 2)",
      "name": "heat PDE"
    }
  ],
  "schema_version": 3,
  "variables": [
    "x",
    "t"
  ]
}
